hospital_name,link,price,title昆明吴氏嘉美美容医院,http://y.soyoung.com/cp222714,1980,【伊婉玻尿酸1ml】【伊婉V大分子塑形1ml】韩国进口品牌玻尿酸 填充塑形 昆明吴氏嘉美美容医院
南京极妍医疗美容,http://y.soyoung.com/cp95706,980,【伊婉玻尿酸1ml】【约惠女神】伊婉玻尿酸1ml
沈阳浑南孙俊医疗美容诊所,http://y.soyoung.com/cp154706,360,【水光针】日记返现低至280！韩国伊婉水光2ml！超强补水体验！
南京杰克斯整形美容,http://y.soyoung.com/cp75272,1580,【伊婉玻尿酸1ml】新客体验价1580！进口韩国伊婉玻尿酸1ml，每人限购一支！
南昌韩雅医疗美容门诊部,http://y.soyoung.com/cp10489,2600,【伊婉玻尿酸】【真品进口1ml】填充一点点，顺滑曲线变女神！
青岛伊美尔国宾整形外科医院,http://y.soyoung.com/cp126103,1998,【伊婉玻尿酸1ml】伊婉 V 进口大分子 隆鼻/眉弓/丰下巴 【官方认证注射专家】3D注射 立体塑形
臻瑞新美医疗美容连锁,http://y.soyoung.com/cp41458,1500,【伊婉玻尿酸1ml】韩国原装进口 正品保证 填充塑形除皱 亚洲人专属的玻尿酸
益阳南湖医疗美容,http://y.soyoung.com/cp208549,1280,【伊婉玻尿酸1ml】【伊碗玻尿酸1ml】伊碗C特惠 不限量购买 免注射费 原装可验 日记返现200起
佳木斯市铭源皇宫医疗美容门诊有限公司,http://y.soyoung.com/cp158742,1280,【伊婉玻尿酸1ml】敢与时间叫板的伊婉C玻尿酸，【限购5支】
PhiSkin芙艾医疗（杭州店）,http://y.soyoung.com/cp104429,3800,【玻尿酸去黑眼圈】PhiSkin芙艾医美 韩国进口伊婉小分子Classic Plus玻尿酸
珠海一韩医疗美容,http://y.soyoung.com/cp102825,1980,【伊婉玻尿酸1ml】玻尿酸注射 立体塑形 提升颜值 保湿除皱 见效快，提拉紧肤
君绮·凯瑞诊所（上海凯瑞医疗美容门诊部）,http://y.soyoung.com/cp95784,1280,【玻尿酸全脸填充】【明星御用】台湾名医直飞亲打~伊婉C小分子！全脸任意打，面部填充，除皱塑型
北京悦丽汇财富中心诊所,http://y.soyoung.com/cp70499,3000,【伊婉玻尿酸1ml】伊婉V大分子玻尿酸1ml，打造立体容颜
上海纽赛医疗美容,http://y.soyoung.com/cp39545,580,"【海薇玻尿酸0.5ml】海薇玻尿酸0.5ML 苹果肌/嘟嘟唇/下巴/卧蚕,玻尿酸来袭,润百颜/伊婉/瑞蓝"
三亚西尔维娅医疗美容,http://y.soyoung.com/cp130780,2980,【伊婉玻尿酸1ml】伊婉玻尿酸 1ml 填充完美面部轮廓 让你水润饱满 除皱塑动人脸形！
武汉米兰医疗美容门诊部,http://y.soyoung.com/cp97401,1314,【伊婉玻尿酸1ml】【韩国伊婉玻尿酸1ml】精塑立体饱满轮廓 淡化岁月痕迹
武汉鹏爱静港医疗美容,http://y.soyoung.com/cp124988,1980,【伊婉玻尿酸1ml】韩国进口 大分子V型 填充塑形 强效除皱 单支仅1980
青岛诺德医学美容医院,http://y.soyoung.com/cp151157,980,【玻尿酸隆鼻】明星系列.韩国伊婉玻尿酸，伊婉C/1ml 韩国原装进口玻尿酸 微雕塑形 
汕头伊丽莎白整形美容,http://y.soyoung.com/cp125139,1199,【伊婉玻尿酸1ml】玻尿酸填充 正品承诺 名师注射 塑形佳 持效久
丽诗丽格医疗美容,http://y.soyoung.com/cp258334,680,【玻尿酸】伊婉 伊婉C 1ml ，亚洲人的专属玻尿酸！明星专家团队坐诊 杨明强倾情注射！
长沙艾依美医疗美容,http://y.soyoung.com/cp12609,2280,【伊婉玻尿酸1ml】私信领取无门槛红包原装正品 伊婉V 1毫升不限购 免注射费 正品可验 
沈阳斯美诺医疗美容连锁（原沈阳和平耿成虎）,http://y.soyoung.com/cp295520,888,【玻尿酸】伊婉 伊婉C 1ml ，院长注射，立现精致五官，女神都无法抗拒的童颜神器
深圳博济医疗美容门诊部,http://y.soyoung.com/cp106349,688,【伊婉玻尿酸1ml】伊碗玻尿酸（韩国进口）C-PLUS【限购一支】
青岛刘晋胜医疗美容诊所,http://y.soyoung.com/cp6116,2256,【伊婉玻尿酸】 刘晋胜医疗美容诊所 韩国伊婉玻尿酸 
郑州东方女子医院,http://y.soyoung.com/cp62366,980,【玻尿酸丰卧蚕】【618大促价】风靡韩国的伊婉C玻尿酸 午休时间偷偷变美 补水保湿强力除皱塑形~
郑州明星医疗美容,http://y.soyoung.com/cp38099,1680,【玻尿酸丰卧蚕】伊婉玻尿酸小分子1ml原装真品支持当场检验～
民航广州医院,http://y.soyoung.com/cp258669,1680,【玻尿酸】伊婉 伊婉C 1ml ，保证正品 支持验证 含注射费
哈尔滨211医院,http://y.soyoung.com/cp65594,6240,【伊婉玻尿酸】【哈尔滨211医院@黄志有】塑饱满精致容颜 哪里不美打哪里 女神翘鼻 V脸下巴 
PhiSkin芙艾医疗,http://y.soyoung.com/cp104424,3800,【玻尿酸填充卧蚕】伊婉 C Plus 韩国进口玻尿酸 限量！正品保障
成都大华韩艺整形美容医院,http://y.soyoung.com/cp77853,1314,【伊婉玻尿酸1ml】｛大华韩艺｝进口伊婉玻尿酸，支持正品验证！塑颜立体饱满，萌妹纸必备
长沙健丽美臣铂宫医疗整形,http://y.soyoung.com/cp46952,1680,【伊婉玻尿酸1ml】伊婉C进口玻尿酸  正品保障 先验药后注射 告别凹陷 塑造立体五官 无痛注射卧蚕
重庆美禅整形美容,http://y.soyoung.com/cp119742,968,【伊婉玻尿酸1ml】【伊婉玻尿酸】赶走衰老 塑造“有型”脸蛋
上海慕正医疗美容外科（原上海清杨）,http://y.soyoung.com/cp153390,3480,【伊婉玻尿酸1ml】伊婉v型大分子plus，立体感强，维持时间久！
秦皇岛慈善医院,http://y.soyoung.com/cp75643,3180,【伊婉玻尿酸1ml】伊婉大分子玻尿酸volume s 1ml 效果更持久 给你精致好面容
昆明博美医疗美容门诊部,http://y.soyoung.com/cp85830,1200,【玻尿酸隆鼻】【伊婉玻尿酸1ML】原装正品，为你打造小翘鼻
三亚西尔维娅医疗美容,http://y.soyoung.com/cp130788,1680,【伊婉玻尿酸1ml】原装韩国进口伊婉玻尿酸1ml 正品塑形好！限量优惠价格！
武汉忆美凯德医疗美容,http://y.soyoung.com/cp79580,1980,【光子嫩肤+伊婉】组合优惠➊包机票+住宿➋1888元红包➌网约专车 
扬州美贝尔医疗美容,http://y.soyoung.com/cp59930,1380,【伊婉玻尿酸1ml】【限时抢购】【韩国进口】3分钟塑性变美不留痕迹 韩国人气玻尿酸
北京悦丽汇财富中心诊所,http://y.soyoung.com/cp1082,980,【伊婉玻尿酸1ml】韩国进口伊婉c玻尿酸1ml（不限购），立现少女脸
芜湖市第一人民医院,http://y.soyoung.com/cp23839,1980,【伊婉玻尿酸】【芜湖一院@张少翔】伊婉中分子玻尿酸
绍兴维美美容医院,http://y.soyoung.com/cp298004,980,【玻尿酸】伊婉 伊婉C 1ml ，韩国进口玻尿酸 时尚网红之选 包注射费(伊婉1ML)
北京悦丽汇三里屯诊所,http://y.soyoung.com/cp6531,980,【伊婉玻尿酸1ml】伊婉c1ml 立体轮廓塑形 塑造精致五官 正规品质，当场验货，不限购
新疆梁青松医疗美容诊所,http://y.soyoung.com/cp95556,2500,【韩国伊婉玻尿酸1ml】韩国原装进口伊婉玻尿酸 1ml 超值变美
三亚圣迪亚整形美容医院,http://y.soyoung.com/cp30466,2980,【伊婉玻尿酸】韩国进口1ml玻尿酸 
武汉洪山爱美汇整形美容,http://y.soyoung.com/cp41551,2980,【伊婉玻尿酸1ml】【不满意不给钱】V型大分子更持久➊瞿大大注射➋送进口鼻假体➌价格抄底➍原装进口
合肥光美医疗整形美容,http://y.soyoung.com/cp132278,1980,【伊婉玻尿酸1ml】【伊婉买一赠一】原装进口  专家亲自注射  网红脸/处女脸/次元脸任你选
广州智媄医美门诊,http://y.soyoung.com/cp52757,688,【伊婉玻尿酸】【热销】韩国伊婉C玻尿酸特卖（限拍1次，首拍不限购）
深圳恩吉娜医疗美容门诊部,http://y.soyoung.com/cp245900,799,【伊婉玻尿酸1ml】进口伊婉玻尿酸，一针塑造饱满立体容颜，仅售799！
南华大学附属第一医院,http://y.soyoung.com/cp31628,1500,【伊婉玻尿酸】【南华大学附属第一医院@李明】伊婉玻尿酸1ml
上海科发源医疗美容,http://y.soyoung.com/cp21669,1680,【伊婉玻尿酸1ml】玻尿酸隆鼻/丰太阳穴/丰面颊/垫下巴/丰苹果肌/丰丰唇/丰卧蚕/丰泪沟/去法令纹
上海慕正医疗美容外科（原上海清杨）,http://y.soyoung.com/cp98888,2999,【韩国伊婉玻尿酸1ml】伊婉v大分子，时间长达16个月，舒适感强，塑形效果好
安徽维多利亚整形外科医院,http://y.soyoung.com/cp115482,1380,【伊婉玻尿酸1ml】伊婉C玻尿酸（免注射费）正品保障 支持验证
德尔美客医疗美容深圳旗舰店,http://y.soyoung.com/cp200362,1037,【伊婉玻尿酸1ml】【伊婉玻尿酸1ml】进口原装 伊婉C 伊婉V 大分子 小分子
常德曹家整形医疗美容医院,http://y.soyoung.com/cp127911,1680,【伊婉玻尿酸1ml】原装进口伊婉C型玻尿酸，名医注射，品质保障
上海李月辉医疗美容诊所,http://y.soyoung.com/cp172153,980,【伊婉玻尿酸1ml】【李月辉团队】伊婉玻尿酸长效 塑形更持久 精致填充 塑造立体饱满童颜
广州皇佳贝丽医疗美容门诊部,http://y.soyoung.com/cp92899,1680,【韩国伊婉玻尿酸1ml】朱博亲诊，韩国原装正品  立体轮廓塑形 打造精致五官
韩国首尔丽格皮肤科医院,http://y.soyoung.com/cp75262,1580,【注射玻尿酸隆鼻】伊婉最适合东方人的玻尿酸·玻尿酸隆鼻
济南海峡美容整形医院,http://y.soyoung.com/cp226134,1260,【伊婉玻尿酸1ml】韩国进口玻尿酸伊婉C plus 1ml正品保证！主任级院长亲自注射，仅限首支体验
北京美诗沁医疗美容,http://y.soyoung.com/cp113063,1680,【伊婉玻尿酸1ml】【买2送1】伊婉C玻尿酸 保真足量(1ml)，主任医师注射 本月限免注射费！
福州比华利美容医院,http://y.soyoung.com/cp152779,1680,【伊婉玻尿酸1ml】【下单送皮肤检测】 免注射费 超值大回馈 塑造立体五官 逆转肌肤年龄
长沙协雅医疗美容,http://y.soyoung.com/cp6204,2980,【伊婉玻尿酸1ml】正品原装1ml  填充心形脸，下巴必备玻尿酸，限购1支
北京悦丽汇三里屯诊所,http://y.soyoung.com/cp54892,3000,【伊婉玻尿酸1ml】大分子伊婉V玻尿酸，下巴鼻子专属玻尿酸
长春正韩医疗美容门诊部,http://y.soyoung.com/cp10659,1380,【伊婉玻尿酸】【伊婉2型玻尿酸1ml】正品行货仅售1380
北京叶美人医疗美容诊所,http://y.soyoung.com/cp154841,2480,【伊婉玻尿酸1ml】伊婉C plus 注射自然不突兀  面部轮廓更立体
哈尔滨臻美医疗美容,http://y.soyoung.com/cp152770,1580,【伊婉玻尿酸1ml】【韩国伊婉Cplus】进口原装 100%正品 让青春不再是奢侈品，变美不留痕迹
长治悦美医疗美容,http://y.soyoung.com/cp100610,1980,【伊婉玻尿酸1ml】【伊婉玻尿酸】原装正品 大分子玻尿酸1ml 塑形效果更佳持久
廊坊华康整形,http://y.soyoung.com/cp62231,1688,【伊婉玻尿酸】韩国进口1mL正品保证，填充+塑形
沈阳盛京尚美医疗美容,http://y.soyoung.com/cp55618,899,【伊婉玻尿酸】正品安全保障，微整神器，做精致美人！
宁波建国医疗美容,http://y.soyoung.com/cp57673,1880,"【伊婉玻尿酸】<1ML周年庆特惠>院长亲诊,建院20周"
郑州管城赵灵卿【美岚整形】,http://y.soyoung.com/cp65900,749,【伊婉玻尿酸1ml】伊婉玻尿酸C1ml 韩国原装进口正品   免专家注射费
济南美康医院,http://y.soyoung.com/cp9319,1280,【伊婉玻尿酸1ml】【下单送项目】填充/除皱/塑性 塑造立体五官 轻松变女神
上海瑞芙臣医疗美容,http://y.soyoung.com/cp62118,3000,【玻尿酸隆鼻】【伊碗大分子玻尿酸1ml】塑性更立体见效！超值优惠！
扬州雷医生整形外科（原扬州美安）,http://y.soyoung.com/cp7914,880,【伊婉玻尿酸】韩国进口伊婉玻尿酸 1ML 超实惠脸型靓丽法宝
上海爱莫儿医疗美容,http://y.soyoung.com/cp268502,460,【玻尿酸】海薇 海薇 1ml ， 瑞蓝/润百颜/伊婉/海薇/法思丽/嗨体/长效塑型、get电影女主立体小v脸~
上海仁爱医院,http://y.soyoung.com/cp66328,2980,【伊婉玻尿酸1ml】进口玻尿酸 塑性填充 正品保证 伊婉V型玻尿酸1ml 优惠价2980元 /ml
烟台华怡医学美容医院,http://y.soyoung.com/cp26016,1650,【伊婉玻尿酸1ml】【医院返现】私信即送脱毛 美甲二选一 塑形除皱 原装真品 支持验货 每人限购一支
上海星采医疗美容门诊部,http://y.soyoung.com/cp151972,1480,【伊婉玻尿酸1ml】原装正品支持当场检验!
重庆徐铎丽格医疗美容,http://y.soyoung.com/cp31779,2980,【伊婉玻尿酸1ml】 @五官塑性田云浩医师 伊婉玻尿酸V型1ml 立体塑形隆鼻 更长效
宁波颜术医美,http://y.soyoung.com/cp19528,999,【伊婉玻尿酸1ml】宁波颜术原装进口正品玻尿酸伊婉C 鼻子下巴泪沟法令纹太阳穴
东莞宝格丽医疗美容门诊部,http://y.soyoung.com/cp52935,1999,【伊婉玻尿酸1ml】宝格丽韩国进口伊婉C玻尿酸 美丽无痕填充塑型
长沙皕诚和隽整形医疗美容,http://y.soyoung.com/cp104490,988,【伊婉玻尿酸1ml】咨询有礼 填充额头/苹果肌/泪沟/太阳穴/下巴 名医注射 去皱填充 脸部圆润饱满
九江瑞丽医疗美容,http://y.soyoung.com/cp89743,1880,【韩国伊婉玻尿酸1ml】【伊婉玻尿酸1ml】原装真品支持在场验货
郑州俪侬整形美容,http://y.soyoung.com/cp66470,1680,【伊婉玻尿酸1ml】伊婉玻尿酸 1ml 韩资医院 让自己绽放美丽光彩 进口真品
重庆精美整形,http://y.soyoung.com/cp153207,2850,【伊婉玻尿酸1ml】【小仙女套餐】伊婉C*1+伊婉C*2支 全网年度低价，买一支得三支
烟台IB医疗美容整形(艺容医疗美容门诊部),http://y.soyoung.com/cp109427,698,【伊婉玻尿酸1ml】【伊婉玻尿酸】除皱  塑形  补水
保定悦容医疗美容,http://y.soyoung.com/cp66159,1680,【伊婉玻尿酸】【注射微整】保定原装正品伊婉C玻尿酸 1ml 特惠活动
昆明丽都医疗美容医院,http://y.soyoung.com/cp29118,1680,【伊婉玻尿酸】韩国进口伊婉C型玻尿酸 1.0ML  重塑立体轮廓  特价抢购中！
南昌莱美美容医院,http://y.soyoung.com/cp280757,1280,【玻尿酸】伊婉 伊婉C 1ml ，免注射费，首支体验价1ML，支持先验证后注射，100%正品。
重庆玺悦台医疗美容,http://y.soyoung.com/cp105322,4960,【玻尿酸丰卧蚕】小仙女套餐 :伊婉C * 1 (1ml)+伊婉C同产品 * 2 (2*1ml)
廊坊凯润婷医疗美容门诊部,http://y.soyoung.com/cp90165,1760,【韩国伊婉玻尿酸1ml】【伊婉V型】塑形大分子玻尿酸，打造笔挺俏鼻
金丽医疗,http://y.soyoung.com/cp50417,1080,【伊婉玻尿酸1ml】@注射大师朱院长 上帝手中的混泥土 1秒见效 玻尿酸隆鼻、垫下巴  伊婉C
民航上海医院整形外科,http://y.soyoung.com/cp10142,1899,【伊婉玻尿酸】伊婉1ml，特价优惠原装正品买五送一
昊阳医疗美容诊所,http://y.soyoung.com/cp54885,1980,【伊婉玻尿酸】【台州伊婉玻尿酸1ML】想美哪里美哪
重庆珂琳雅整形美容医院,http://y.soyoung.com/cp153301,790,【玻尿酸隆鼻】伊婉正品玻尿酸，正品保障，支持当场验货，填充/隆鼻，拒绝“平”庸
沈阳欣博美医疗美容门诊部,http://y.soyoung.com/cp2697,1780,【玻尿酸隆鼻】伊婉C玻尿酸1ml   送光子嫩肤+黑脸娃娃+洗牙各一次 微雕填充小资人士的首选
重庆联合丽格美容医院,http://y.soyoung.com/cp31374,2280,【伊婉玻尿酸1ml】【好评返现30元】正品保证 三甲品质 伊婉V型   免专家注射费 
南通维多利亚医疗美容医院,http://y.soyoung.com/cp19862,1777,【伊婉玻尿酸1ml】【7周年庆】韩国进口玻尿酸 伊婉C型 提升面部 填充鼻下巴 唇 苹果肌 太阳穴 
北京奥德丽格医疗美容门诊部,http://y.soyoung.com/cp30137,1314,【玻尿酸隆鼻】【1314针剂组】伊婉c玻尿酸+衡力鱼尾纹除皱针+无针水光，填充塑形祛皱
重庆玺悦台医疗美容,http://y.soyoung.com/cp105318,1314,【伊婉玻尿酸1ml】伊婉玻尿酸c型，正品支持现场验货（瑞蓝玻尿酸/乔雅登玻尿酸）
中国医学科学院整形外科医院,http://y.soyoung.com/cp266466,1580,【玻尿酸】伊婉 伊婉C 1ml ，【八大处&amp;玻尿酸】专家陈莹医生亲诊，公立三甲，安全打造
南京美范整形美容,http://y.soyoung.com/cp102579,639,【伊婉玻尿酸1ml】【私信领红包】【爆款】伊婉/进口玻尿酸/中小分子 买就送 详询客服宝宝
杭州昕薇医疗美容,http://y.soyoung.com/cp10114,1980,【玻尿酸隆鼻】 进口伊婉C玻尿酸1ML 全力填充
天津滨海新区怡贝医疗美容门诊部,http://y.soyoung.com/cp117635,1500,【伊婉玻尿酸1ml】【伊婉1ML】填充面颊，超值抢购，打造冻龄女神，火爆预定中！
哈尔滨即美整形美容,http://y.soyoung.com/cp89914,1580,【韩国伊婉玻尿酸1ml】童颜魔法师吴显宇亲诊私信领红包  正品进口大分子伊婉玻尿酸 
深圳和美医疗美容,http://y.soyoung.com/cp136141,9800,【伊婉玻尿酸1ml】【囤货价】进口伊婉C玻尿酸10支10ml 丰下巴/额头/面颊/苹果肌等 限时特惠
杭州静娇医疗整形美容,http://y.soyoung.com/cp141265,1680,【伊婉玻尿酸1ml】韩国原装伊婉玻尿酸，真品保障！支持当场检验 十分钟重现⻘春童颜，超高性价比!
大连许英医疗美容,http://y.soyoung.com/cp30206,1399,【伊婉玻尿酸】伊婉玻尿酸1ml特惠进行中，速速抢购！
淮安苏美尔医疗美容,http://y.soyoung.com/cp80823,1980,【伊婉玻尿酸1ml】进口伊婉C玻尿酸1ml，精致五官，闪耀容颜，让你更自信面对人生~
北京叶美人医疗美容诊所,http://y.soyoung.com/cp153890,3480,【伊婉玻尿酸1ml】【伊婉玻尿酸】伊婉V plus*1支 饱满丰盈 立体轮廓 一部到位
昂方医疗美容,http://y.soyoung.com/cp84346,3980,【韩国伊婉玻尿酸1ml】伊婉V玻尿酸 塑形补水两不误 亚洲人玻尿酸的不二选择
徐州洪扬医疗美容诊所,http://y.soyoung.com/cp141411,1280,【伊婉玻尿酸1ml】1ml /每人限购1支，专家注射，保证正品
城关区庆阳路明伦医疗美容门诊部,http://y.soyoung.com/cp34984,1680,【伊婉玻尿酸】1ML 原装正品支持当场检验
郴州新曹家医疗美容,http://y.soyoung.com/cp133819,1680,【伊婉玻尿酸1ml】原装进口伊婉玻尿酸，名医注射，品质保障
西安瑞诺(希美得)医疗美容,http://y.soyoung.com/cp135029,1980,【伊婉玻尿酸1ml】【希美得医疗美容】伊婉玻尿酸1ML，原装正品支持现场验证
重庆玺悦台医疗美容,http://y.soyoung.com/cp105316,5088,【玻尿酸隆鼻】天鹅鼻套餐：伊婉V plus*1+伊婉V*1
深圳刘运奇医疗美容诊所,http://y.soyoung.com/cp65683,880,【伊婉玻尿酸】强势入驻新氧！伊婉玻尿酸1ML880不限
贵阳云岩纤乐儿医疗美容诊所,http://y.soyoung.com/cp68273,6800,【伊婉玻尿酸】韩国伊婉玻尿酸1ML 原装真品支持当场检验
广西玉林现代医院（华美整形）,http://y.soyoung.com/cp253510,1280,【伊婉玻尿酸1ml】【私信领红包】玉林华美伊婉C小分子 名医注射 长效持久 写日记获20%返现
宁波艺星医疗美容医院,http://y.soyoung.com/cp255112,3800,【玻尿酸】艾莉薇 艾莉薇 1ml ，伊婉私信领红包 私信还送玻尿酸 上门送补水季卡   限新客  保真可验
珠海方华整形美容门诊部 ,http://y.soyoung.com/cp258825,1980,【玻尿酸】伊婉 伊婉C 1ml ，正品伊婉玻尿酸1ml，现场验证，塑型/除皱，愿时光不曾光顾你，私信有惊喜
温州东华医院,http://y.soyoung.com/cp260411,1680,【玻尿酸】伊婉 伊婉C 1ml ，【下单即送皮肤管理一次】韩国进口伊婉C玻尿酸1ml 女生都无法抗拒的童颜神器
衡阳曹家医疗美容,http://y.soyoung.com/cp203434,1680,【伊婉玻尿酸1ml】原装进口伊婉玻尿酸，名医注射，品质保障
泉州欧菲整形,http://y.soyoung.com/cp208357,1580,【伊婉玻尿酸1ml】韩国进口人气玻尿酸 塑脸神器
济南海峡美容整形医院,http://y.soyoung.com/cp234947,2680,【伊婉玻尿酸1ml】【伊婉玻尿酸V Plus 1ml】升级版精雕塑形，立体感强，维持时间久，院长注射
丹东市第一医院国际医疗部整形美容科,http://y.soyoung.com/cp238110,3230,【伊婉玻尿酸1ml】韩国原装进口正品伊婉玻尿酸 除皱美白填充塑形 打造少女脸专业订制 
泉州西华医疗美容,http://y.soyoung.com/cp243180,2980,【伊婉玻尿酸1ml】伊婉C plus，主任亲诊，打造年轻饱满的脸庞，下单有红包，送精美礼品
长沙健丽美臣铂宫医疗整形,http://y.soyoung.com/cp263798,1680,【玻尿酸】伊婉 伊婉C 1ml ，【玻尿酸隆鼻】23年专业医美 玻尿酸填充 鼻部  立竿见影
武汉五洲莱美整形美容医院,http://y.soyoung.com/cp264064,8800,【玻尿酸】乔雅登 乔雅登雅致 0.8ml ，海薇680元  3支以上每支520元  润百颜/伊婉/娇兰/艾莉微/瑞蓝/乔雅登
QT女性医院,http://y.soyoung.com/cp177527,950,【伊婉玻尿酸0.5ml】【伊婉 】玻尿酸 女神的秘诀！！春节特价
重庆真格医疗美容门诊部,http://y.soyoung.com/cp183416,988,【伊婉玻尿酸1ml】伊婉玻尿酸
济南历下君萍医疗美容诊所,http://y.soyoung.com/cp185029,1280,【伊婉玻尿酸1ml】韩国进口 正品保证！立体轮廓塑形 重塑精致五官！写日记医院返现300，私信送项目
国济美容整形中心,http://y.soyoung.com/cp151201,999,【伊婉玻尿酸1ml】日记专享价  伊婉C 不限购 明星专家注射 解决面部凹陷 使你重返年轻
济南润境整形医院,http://y.soyoung.com/cp160307,3360,【伊婉玻尿酸1ml】【伊婉玻尿酸1ml】伊婉大分子玻尿酸＋小分子 名医足量注射 打造明星脸 安全保证
石家庄艾麦德医疗美容,http://y.soyoung.com/cp172706,1680,【玻尿酸】【六六特惠】伊婉C小分子1ml♀玻尿酸丰唇 嘟嘟唇/微笑唇 魅力十足^_^
丹东富雅华医医疗美容整形,http://y.soyoung.com/cp193123,1680,【伊婉玻尿酸1ml】丹东富雅华医 伊婉玻尿酸 除皱/塑形/保湿多效合一
长沙希美医疗美容,http://y.soyoung.com/cp272803,1680,【玻尿酸】伊婉 伊婉C 1ml ，玻尿酸丰眼窝 年轻的秘密 变美不留痕迹【私信客服领红包+下单送美肤】
北京新美荟医疗美容诊所,http://y.soyoung.com/cp273041,6800,【玻尿酸】乔雅登 乔雅登雅致 0.8ml ，【下单到院就送小气泡】【伊婉V玻尿酸1280】可填充可塑性，轻松拥有元气少女脸
天津和平高丽美迹皮肤诊所,http://y.soyoung.com/cp273339,990,【玻尿酸】伊婉 伊婉C 1ml ，❤玻尿酸来袭❤ 瑞百颜/伊婉/艾丽薇  正品进口保证 无注射费/麻醉费 私信领
上海珞俪医疗美容门诊部,http://y.soyoung.com/cp280897,1290,【伊婉玻尿酸1ml】伊婉 伊婉C 1ml ，伊婉C玻尿酸注射隆鼻垫下巴面部填充塑形V脸
东湖区美皇医疗美容门诊部 ,http://y.soyoung.com/cp302114,1580,【玻尿酸】伊婉 伊婉C 1ml ，伊婉C玻尿酸1ML★重塑立体轮廓★逆转肌肤年龄★原装进口★支持现场验货★限购一支
米兰（武汉）医疗美容,http://y.soyoung.com/cp305271,3680,【玻尿酸】伊婉 伊婉C 1ml ，【米兰变美季】【玻尿酸祛静态纹】紧致提升颈部皮肤 赶走颈纹对抗时间魔咒
北京伊美尔幸福医疗美容医院,http://y.soyoung.com/cp291407,7800,【玻尿酸】伊婉 伊婉V 1ml ，【私信领红包】北京伊美尔伊婉V大分子 长久塑型 效果卓越 正品保障 
大直超龙医疗美容医院,http://y.soyoung.com/cp291659,1380,【玻尿酸】伊婉 伊婉C 1ml ，正品进口小分子伊婉玻尿酸  用于面部不同部位注射填充、除皱塑形
苏州园区美莱医疗美容,http://y.soyoung.com/cp292648,1314,【玻尿酸】伊婉 伊婉C Plus 1ml ，美莱品牌玻尿酸 1ml 专家注射 保证正品 限购1支
紫藤花语医美连锁,http://y.soyoung.com/cp293170,980,【伊婉玻尿酸】伊婉 伊婉C Plus 1ml ，特惠秒杀下单赠项目 正品长效 隆鼻/丰下巴/丰太阳穴/丰额头/丰苹果肌
南昌方大医疗美容,http://y.soyoung.com/cp293415,1280,【玻尿酸】伊婉 伊婉C 1ml ，网红爆款项目 全网低价 保真足量 不红肿 注射完即可约会
珠海艾瑞医疗美容,http://y.soyoung.com/cp294755,1680,【玻尿酸】伊婉 伊婉C 1ml ，珠海艾瑞医美微整形伊婉玻尿酸 安心注射一针见效
苏州园区美莱医疗美容,http://y.soyoung.com/cp295601,980,【玻尿酸】伊婉 伊婉C 1ml ，美莱品牌玻尿酸 1ml 专家注射 保证正品 限购1支
宁波艺星医疗美容医院,http://y.soyoung.com/cp295957,2980,【玻尿酸】姣兰 姣兰 1ml ，伊婉私信领红包 私信还送玻尿酸 上门送补水季卡   限新客  保真可验
广西广丽医疗美容有限公司,http://y.soyoung.com/cp296366,16800,【埋线提升】【埋线提升套餐】PPDO下颌缘提拉+肉毒素下颌缘提升+2ml伊婉玻尿酸紧致心形脸
天津圣韩美医疗美容,http://y.soyoung.com/cp307068,1314,【玻尿酸】伊婉 伊婉C 1ml ，【玻尿酸填充泪沟】韩国进口伊婉c玻尿酸 +光子嫩肤，人气爆款 轻松立体五官
