hospital_name,link,price,title河南省整形美容研究中心,http://y.soyoung.com/cp77195,1680,【伊婉玻尿酸1ml】【公立医院】韩国原装进口伊婉玻尿酸小分子1m，保证正品 支持检验
郑州安琪儿医疗美容,http://y.soyoung.com/cp56879,799,【玻尿酸隆鼻】【元气少女脸】伊婉玻尿酸1ML塑形 买一送一 限时抢购
广州懿美秀整形美容,http://y.soyoung.com/cp199696,980,【伊婉玻尿酸1ml】韩国伊婉小分子1ml 重塑面部轮廓@罗辉院长亲自注射
上海仁爱医院,http://y.soyoung.com/cp47522,888,【伊婉玻尿酸1ml】韩国进口伊婉C玻尿酸1ml 正品保证 塑造精致立体五官（每人限购1支）
厦门思明安黛美整形外科门诊部,http://y.soyoung.com/cp221619,980,【伊婉玻尿酸1ml】【限购1支】➊进口玻尿酸 大促专享特价➋全脸填充塑性补水➌下单到院送水光1次
成都昆贝拉医疗美容中心,http://y.soyoung.com/cp112178,1980,【伊婉玻尿酸1ml】伊婉玻尿酸大分子1ml韩国进口原装正品 隆鼻 丰下巴丰苹果肌丰面颊卧蚕 嘴唇.
新氧云诊所北京丽扬店,http://y.soyoung.com/cp22203,1680,【玻尿酸去法令纹】【微整大促月】拒绝“平”庸就现在 韩国进口伊婉小分子玻尿酸 
武汉新至美医疗美容（武昌院）,http://y.soyoung.com/cp135941,980,【伊婉玻尿酸1ml】伊婉C1ML玻尿酸，支持验货。正品进口畅销品品牌
厦门思明欧菲医疗美容门诊部,http://y.soyoung.com/cp152043,3980,【伊婉玻尿酸2ml】超值套餐 伊婉c+伊婉v+衡力瘦脸针100单位 限时优惠体验
济南吉芙医疗美容诊所,http://y.soyoung.com/cp308236,868,【玻尿酸】舒颜 舒颜 1ml ，舒颜/瑞蓝/伊婉Plus/法思丽玻尿酸，丰太阳穴/丰额头/丰苹果肌/丰下巴/隆鼻
荆州中爱整形美容,http://y.soyoung.com/cp9253,1980,【伊婉玻尿酸1ml】伊婉1ml玻尿酸优惠大放送
温州星范整形美容,http://y.soyoung.com/cp15708,1680,【玻尿酸填充额头】【伊婉玻尿酸】韩国进口玻尿酸1ML  无任何附加费用  
宁波艺星医疗美容医院,http://y.soyoung.com/cp255107,398,【玻尿酸】润百颜 润百颜白紫 1ml ，伊婉私信领红包 私信还送玻尿酸 上门送补水季卡   限新客  保真可验
金华亚美整形美容,http://y.soyoung.com/cp61365,3618,【玻尿酸垫下巴】【618电商】女神必选 伊婉3连针 韩国正品长效玻尿酸 强效稳定塑形 支持储存
天津耶利亚医疗美容医院,http://y.soyoung.com/cp176093,799,【伊婉玻尿酸1ml】【南开医院医联体】私信领红包 韩国进口伊婉玻尿酸 正品保障 支持现场验证 
南昌韩美美容医院,http://y.soyoung.com/cp75341,1680,"【玻尿酸】【韩国伊婉1ML】私信领红包,路费报销  MD Code分层注射塑造"
上海欧莱美医疗美容医院,http://y.soyoung.com/cp273554,1560,【玻尿酸】伊婉 伊婉C 1ml ，进口玻尿酸伊婉C 2ml 2支套餐价格！！ 专家注射 不限部位！ 
广州韩后医疗美容,http://y.soyoung.com/cp263238,980,【玻尿酸】伊婉 伊婉C 1ml ，【六月童颜季】【伊婉1ml玻尿酸】 正品保证支持现场验真伪 限购1支
长沙丽都医疗美容医院,http://y.soyoung.com/cp152640,980,【伊婉玻尿酸1ml】进口玻尿酸 咨询有礼红包限量领取 名医注射 满额享受免费分期 紧致塑形
北京焕誉医疗美容门诊部,http://y.soyoung.com/cp56807,688,【伊婉玻尿酸1ml】#6.6限时优惠#【达人推荐】名医注射，韩国进口
德尔美客医疗美容襄阳店,http://y.soyoung.com/cp208450,880,【伊婉玻尿酸1ml】【伊婉玻尿酸1ml】100%进口原装 伊婉C 超值尝鲜价
武汉蜜司医疗美容,http://y.soyoung.com/cp263385,699,【玻尿酸】润百颜 润百颜白紫 1ml ，❤私信红包①玻尿酸打造少女脸②支持现场正品验证③润百颜/伊婉/瑞蓝/艾丽薇/舒颜
福州鼓楼医院,http://y.soyoung.com/cp21811,1980,【伊婉玻尿酸】【伊婉C玻尿酸】1980元1ml超值大回馈 变身女神
石家庄天伊美医疗美容医院,http://y.soyoung.com/cp258933,880,【伊婉玻尿酸1ml】伊婉 伊婉C 1ml ，【韩国进口原装】伊婉c小分子 除皱填充 打造青春精致面庞
西安晶肤医疗美容,http://y.soyoung.com/cp86231,980,【玻尿酸隆鼻】【伊婉玻尿酸】【限时预售】人气玻尿酸特惠，上市医美，正品安全双保障
武汉新至美医疗美容（武昌院）,http://y.soyoung.com/cp135957,2980,"【伊婉玻尿酸1ml】伊婉V1ml大分子,原装进口支持现场验货,下单立送涂抹式玻尿酸"
北京蜜邦医疗美容诊所,http://y.soyoung.com/cp177648,2180,【玻尿酸】线上下单到院可送小气泡治疗  北京1毫升伊婉V隆鼻，丰下巴
上海美立方医疗美容医院,http://y.soyoung.com/cp103365,1580,【伊婉玻尿酸1ml】婉C送（润月雅水光针2ml+面膜）  童颜“娃娃脸”“捏”出立体五官
北京丽雅医疗美容诊所,http://y.soyoung.com/cp258914,748,【玻尿酸】伊婉 伊婉C 1ml ，伊婉c玻尿酸塑形填充，支持验药
西安维美大眼睛医疗美容,http://y.soyoung.com/cp290583,888,【玻尿酸】伊婉 伊婉C 1ml ，伊婉C型玻尿酸 韩国进口玻尿酸 不限购 先验药后注射 无注射费
重庆时光整形美容医院,http://y.soyoung.com/cp111698,980,【伊婉玻尿酸1ml】【丰下巴/苹果肌/额头】韩国进口玻尿酸980/首支，免注射费
北京水研星源医疗美容诊所,http://y.soyoung.com/cp152008,980,【伊婉玻尿酸1ml】【私信送脱毛+红包】韩国伊婉小分子1ml 重塑面部轮廓@游小明院长亲自注射
易曦医疗美容,http://y.soyoung.com/cp142634,1280,【玻尿酸】【伊婉玻尿酸】原装正品伊婉 V1ml  单只2580元，升级年卡18800元
昆明美伊莱医疗美容门诊部,http://y.soyoung.com/cp9232,1520,【伊婉玻尿酸1ml】【私信送玻尿酸精华导入】韩国进口伊婉玻尿酸，支持现场验货!
广州健丽医美,http://y.soyoung.com/cp61107,749,【其他玻尿酸1ml】韩国正品伊婉玻尿酸1ml，绽放美丽色彩
北京市健宫医院,http://y.soyoung.com/cp293505,1880,【玻尿酸】伊婉 伊婉V 1ml ，【下单就送全年冰点脱毛】 公立二甲名义注射 品质保障--招募案例模特返现100%
北京昕颜医疗美容诊所,http://y.soyoung.com/cp44798,1680,【伊婉玻尿酸】伊婉玻尿酸1ml 打造立体美女
武汉新至美医疗美容医院,http://y.soyoung.com/cp112191,2980,【伊婉玻尿酸1ml】全球畅销 韩国 进口大品牌 伊婉V大分子玻尿酸 塑形优选 现场验货
武汉一美医疗美容,http://y.soyoung.com/cp45811,1280,"【伊婉玻尿酸1ml】伊婉C玻尿酸,名医注射,月销2000+/满分好评红包立减/，再送上门礼"
苏州芘丽芙华美美容医院,http://y.soyoung.com/cp169634,980,【玻尿酸隆鼻】原装进口伊婉C，主任医师注射，10余年微整经验，不肿不痛不扩散
长沙美莱整形美容医院,http://y.soyoung.com/cp42386,1200,【伊婉玻尿酸1ml】【618电商节】伊婉Cplus玻尿酸仅售1200元/1ML；支持正品验证
紫藤花语医美连锁,http://y.soyoung.com/cp295909,980,【玻尿酸】伊婉 伊婉C Plus 1ml ，特惠秒杀下单赠项目 正品长效 隆鼻/丰下巴/丰太阳穴/丰额头/丰苹果肌
深圳太美医疗门诊部,http://y.soyoung.com/cp20895,1980,【玻尿酸去黑眼圈】韩国进口伊婉玻尿酸 1ml 超高纯度 1980元 买一送一
泉州东大医学美容,http://y.soyoung.com/cp176560,899,【伊婉玻尿酸1ml】【下单赠脱毛】两人同行享980元/人 韩国进口伊婉玻尿酸 逆转肌肤年龄
成都花田医学美容,http://y.soyoung.com/cp28574,1666,【玻尿酸隆鼻】【伊婉V型玻尿酸】首次体验价1666，柔针注射，微雕塑型，玻尿酸年卡，抢抢抢！
广州天姿医美,http://y.soyoung.com/cp48241,880,【伊婉玻尿酸1ml】韩国进口 玻尿酸 强效塑形 除皱 补水一步到位 轻松变女神
暨南大学附属深圳华侨医院整形科     ,http://y.soyoung.com/cp304972,799,【玻尿酸】伊婉 伊婉C 1ml ，三级医院 韩国进口伊婉中小分子特惠799/支  主任医师注射  安全保真
北京悦丽汇三里屯诊所,http://y.soyoung.com/cp163014,6599,【伊婉玻尿酸1ml】青春塑颜立挺套餐（5支伊婉c+1支伊婉v塑造鼻背），重塑立体容颜
美贝尔整形医院（中国区旗舰店）,http://y.soyoung.com/cp80695,980,【伊婉玻尿酸1ml】【无注射费】【无点诊费】新客体验价 效果持久
上海江依南医疗美容门诊部,http://y.soyoung.com/cp290954,1980,【玻尿酸】伊婉 伊婉V 1ml ，【玻尿酸】【伊婉玻尿酸】100%正品，积分年底提现，【现场拆包装】验货
深圳美莱医疗美容医院,http://y.soyoung.com/cp127532,3880,【玻尿酸隆鼻】【618电商节】伊婉C玻尿酸/2支装 超值划算 玻尿酸填充苹果肌 面颊
昆明悦格医疗美容,http://y.soyoung.com/cp52296,799,【伊婉玻尿酸1ml】口碑针剂，销量领先，名医大咖联袂认证效果，精雕面部
深圳晨曦医疗美容门诊部,http://y.soyoung.com/cp301687,749,【玻尿酸】伊婉 伊婉C 1ml ，微整注射 午餐美容 网红 主播必备 原装正品 高性价比 支持验货
大连科美整形,http://y.soyoung.com/cp13864,2650,【伊婉玻尿酸】正品伊婉玻尿酸1ml，支持扫码
青岛韩艺美医学整形,http://y.soyoung.com/cp148323,749,【玻尿酸丰卧蚕】【伊婉玻尿酸】塑型补水 分分钟悄然变美 饱满立体 无注射费 
深圳颜美医疗美容门诊部,http://y.soyoung.com/cp105933,749,"【伊婉玻尿酸1ml】私信领红包【伊婉玻尿酸】980元1ML,免注射费，现场验货"
武汉新至美医疗美容医院,http://y.soyoung.com/cp77337,1980,【伊婉玻尿酸1ml】进口伊婉C 填充塑形 超低价韩国原装伊婉C玻尿酸1ml  塑形更持久 现场验货 
北京悦丽汇三里屯诊所,http://y.soyoung.com/cp163025,7999,【玻尿酸隆鼻】青春塑颜立挺套餐（5支伊婉c+1支法思丽塑造鼻背），重塑立体容颜
深圳丽港丽格医疗美容门诊部,http://y.soyoung.com/cp28384,688,【伊婉玻尿酸1ml】韩国伊婉C玻尿酸1ML，品质保证，日记返现200元！
杭州吉奥医疗美容,http://y.soyoung.com/cp121641,2966,【玻尿酸垫下巴】韩国伊婉V大分子玻尿酸 隆鼻/丰下巴性价比之选 热搭线雕 瘦脸针 自体脂肪填充
深圳伊婉医疗美容门诊部,http://y.soyoung.com/cp106180,13800,【自体脂肪填充】童颜处女脸再造 全脸自体脂肪填充（写日记返现2000）
贵阳华美整形美容医院,http://y.soyoung.com/cp82687,980,【玻尿酸】伊婉玻尿酸C 1ml 名医注射 即做即走 强效塑形 不影响工作 无额外费用 
成都星尚美医学美容医院,http://y.soyoung.com/cp103649,680,【伊婉玻尿酸1ml】【小分子】台湾颌面专家注射，精塑五官/俊俏美鼻/乖巧下巴/怎么迷人怎么来
北京金圣整形医疗美容,http://y.soyoung.com/cp74518,2980,【玻尿酸隆鼻】【限时特惠】伊婉V玻尿酸大分子1ml 名医注射，下单即送一百单位衡力回头率杠杠的
天津维美医疗美容医院,http://y.soyoung.com/cp62090,749,【伊婉玻尿酸1ml】平台销量前三/网红脸的秘密武器/年轻人都喜欢的玻尿酸
深圳蒳美迩医疗美容门诊部,http://y.soyoung.com/cp47014,2980,【伊婉玻尿酸1ml】韩国玻尿酸 长效大分子 丰下巴头隆鼻丰苹果肌隆鼻泪沟法令纹 无痛感 
石家庄艾麦德医疗美容,http://y.soyoung.com/cp173448,1080,【玻尿酸】【六六特惠】伊婉V大分子1ml♀正品保证 精致容颜效果显著 微微一填很倾城^_^
青岛亚美妍医疗美容,http://y.soyoung.com/cp313880,780,【玻尿酸】伊婉 伊婉C 1ml ，原装进口伊婉C玻尿酸 无其他费用 院长注射 足量注射 支持验货（限新客限购1支）
厦门海峡医疗美容门诊部,http://y.soyoung.com/cp152761,2980,【玻尿酸隆鼻】【韩国伊婉V大分子】塑形立体更持久下单送小气泡2次或皮肤检测1次
成都星尚美医学美容医院,http://y.soyoung.com/cp103658,980,【伊婉玻尿酸1ml】【伊婉玻尿酸大分子】台湾专家亲自注射，填充鼻子、下巴、苹果肌、额头、补水提升~
福州鼓楼伊美新世纪整形外科门诊部,http://y.soyoung.com/cp120426,1199,【伊婉玻尿酸1ml】伊婉1ml，人气单品90后超爱，现场查验，好评不断！（每人限购一支）
深圳汇仁门诊部,http://y.soyoung.com/cp28140,1980,【伊婉玻尿酸】韩国进口1ML 指定注射医师陈洪
广州轻伊美医疗美容,http://y.soyoung.com/cp206482,880,【伊婉玻尿酸1ml】【限时特价体验】原装进口 扫码验证 适合亚洲人的玻尿酸
南京鼓楼兰桂坊医疗美容诊所,http://y.soyoung.com/cp175980,980,【伊婉玻尿酸1ml】限时特惠 精塑立体 饱满轮廓 打造立体五官 限购1支
赣州华美医疗美容,http://y.soyoung.com/cp201213,1580,【玻尿酸隆鼻】【打响66大促】伊婉C1ml 塑形持久自然❀轻松拥有明星脸❀填充无痕（限购1支）
郑州至美整形美容医院,http://y.soyoung.com/cp28834,1680,【伊婉玻尿酸1ml】注射隆鼻垫下巴面部填充塑形
深圳伊婉医疗美容门诊部,http://y.soyoung.com/cp30758,18,【脱毛】腋毛超低体验价单次588元
韩国首尔丽格皮肤科医院,http://y.soyoung.com/cp64335,3000,【韩国伊婉玻尿酸1ml】伊婉玻尿酸3支（3ml)
北京亚楠容悦医疗美容诊所,http://y.soyoung.com/cp181750,5200,【伊婉玻尿酸3ml】【全网底价+私信送项】伊婉V 日记减800[承诺]20年临床副主任蒋亚楠院长注射
昆明韩辰医疗美容医院,http://y.soyoung.com/cp116054,2980,【伊婉玻尿酸1ml】韩国大分子V玻尿酸1ml，长效塑形！开启美丽之旅（无附加费用）
广州健丽医美,http://y.soyoung.com/cp258774,980,【玻尿酸】伊婉 伊婉C 1ml ，润百颜/伊婉  塑造精致五官，变美不留痕迹 
温州和平整形医院,http://y.soyoung.com/cp137684,980,【伊婉玻尿酸1ml】韩国原装进口伊婉C 支持当场验货 限量限购
江苏南京施尔美整形美容医院,http://y.soyoung.com/cp18958,1480,【伊婉玻尿酸1ml】韩国伊婉1ML，原装正品玻尿酸
徐州市矿务集团总医院整形美容中心,http://y.soyoung.com/cp22681,1680,【伊婉玻尿酸】【徐矿总院@程洋】助您重现美丽立体容颜
上海翡立思医疗美容门诊部,http://y.soyoung.com/cp176226,2980,【伊婉玻尿酸1ml】【韩国进口】伊婉V大分子 填充凹陷 提拉除皱
东莞华美医疗美容,http://y.soyoung.com/cp178900,1580,【伊婉玻尿酸1ml】【6月年中大促】韩国进口伊婉C 买2送1 限购1次！100%原装正品免注射费
南京美好尉来医美,http://y.soyoung.com/cp165126,1680,【伊婉玻尿酸1ml】&lt;日记返现&gt;邵尉院长亲操  进口正品伊婉  一针拥有高萌颜值
杭州同荣丽格医疗美容 ,http://y.soyoung.com/cp298668,2580,【玻尿酸】伊婉 伊婉V 1ml ，【进口玻尿酸】人气爆款/明星秘而不宣的“驻颜魔法”
伊美康医疗美容门诊部,http://y.soyoung.com/cp74087,1680,【玻尿酸隆鼻】不收注射费 原装正品足量1ml 写日记返皮肤项目 韩国伊婉玻尿酸 填充塑形除皱
广州皇佳贝丽医疗美容门诊部,http://y.soyoung.com/cp152633,1980,【伊婉玻尿酸2ml】【伊婉花瓣唇套餐】伊婉Cplus*1+伊婉C*1 柔软填充，无痛注射，除皱更年轻
西安悦华医疗美容门诊部,http://y.soyoung.com/cp37034,1100,【玻尿酸去法令纹】【新氧推荐】韩国进口伊婉 填充塑形效果自然，随做随走
长沙美莱整形美容医院,http://y.soyoung.com/cp78651,2980,【玻尿酸丰卧蚕】【618电商节】伊婉Vplus仅售2980元/1ML；免注射费；支持正品验证。
洛阳谢景良医疗美容,http://y.soyoung.com/cp111085,1280,"【伊婉玻尿酸1ml】【亚洲超人气玻尿酸】填充塑性,打造您的精致轮廓"
上海慕正医疗美容外科（原上海清杨）,http://y.soyoung.com/cp82054,1680,【玻尿酸丰唇】伊婉C plus小分子加强款，维持时间略长，效果更自然
南京美健医疗整形,http://y.soyoung.com/cp83482,880,【伊婉玻尿酸1ml】四月奇遇记【伊婉玻尿酸】低价来袭 好礼相送 
郑州市张朝蕾医疗美容,http://y.soyoung.com/cp82936,1680,【伊婉玻尿酸1ml】郑州伊婉C型玻尿酸1ML 100支限量秒杀  支持当场验货  原装正品
东莞美立方整形美容医院,http://y.soyoung.com/cp115647,4900,【伊婉玻尿酸1ml】【年中大促】进口玻尿酸980起，厂家授权，正品保证，支持现场验货，好评有礼
北京西美医疗美容门诊部,http://y.soyoung.com/cp141225,4224,【伊婉玻尿酸1ml】打造立体精致面容
重庆军科整形医院,http://y.soyoung.com/cp233248,784,【伊婉玻尿酸1ml】进口伊婉玻尿酸1ml  正品保证 填充塑性一把好手 私信领红包 
北京汇恩医疗美容诊所有限公司,http://y.soyoung.com/cp125289,880,【伊婉玻尿酸1ml】韩国原装进口，特惠进行中，速速抢购！
江苏南京施尔美整形美容医院,http://y.soyoung.com/cp153212,2580,【伊婉玻尿酸1ml】进口伊婉大分子玻尿酸，新氧热卖推荐，免注射费
宁波艺星医疗美容医院,http://y.soyoung.com/cp170004,980,【玻尿酸】伊婉C1ml  私信送衡力瘦脸100单位+补水季卡  案例价 限新客~
武汉乐美医疗美容整形,http://y.soyoung.com/cp11838,748,【伊婉玻尿酸1ml】玻尿酸隆鼻、玻尿酸丰卧蚕、玻尿酸丰唇、玻尿酸丰额头、玻尿酸去法令纹/黑眼圈
深圳鹏爱悦己医疗美容医院,http://y.soyoung.com/cp170382,999,【伊婉玻尿酸1ml】韩国原装进口+正品保障+现场可验+名医注射+精致五官
爱彼医疗美容 ,http://y.soyoung.com/cp294274,980,【玻尿酸】伊婉 伊婉C 1ml ，【玻尿酸全脸填充】【韩国原装进口】【六月热销 私信有礼】韩国院长吴院长亲自注射
北京明德医院,http://y.soyoung.com/cp141550,799,【伊婉玻尿酸1ml】【 伊婉C玻尿酸】韩国进口  长效塑形 支持来院拆封验货
河南省整形美容研究中心,http://y.soyoung.com/cp65799,2980,【伊婉玻尿酸1ml】郑州公立医院，伊婉V大分子玻尿酸两支或两人行享8折，改善鼻子/下巴等面部轮廓
青岛妇婴医院,http://y.soyoung.com/cp125272,1680,【伊婉玻尿酸1ml】【私信领红包】伊婉玻尿酸1ml填充苹果肌/额头/太阳穴/法令纹/下巴
杭州婉美医疗美容,http://y.soyoung.com/cp54278,2980,【玻尿酸垫下巴】【V脸套餐】韩国进口伊婉C玻尿酸2ml丰下巴+衡力瘦脸针100单位
台州维多利亚医疗美容,http://y.soyoung.com/cp103790,999,【伊婉玻尿酸1ml】伊婉I型1ml
常州美贝尔整形美容医院（品牌店）,http://y.soyoung.com/cp69686,1580,【伊婉玻尿酸1ml】【限时抢购】【韩国进口】3分钟塑性变美不留痕迹 韩国人气玻尿酸
西安艺美医疗美容,http://y.soyoung.com/cp112031,2680,【伊婉玻尿酸1ml】【西安艺美】伊婉塑形款大分子1ml，变美神器，翘鼻，v下巴，必选大分子玻尿酸
安妮薇尔医疗美容,http://y.soyoung.com/cp121081,1880,【伊婉玻尿酸2ml】原装进口 买一送一 超值特惠 微调塑形 颜值飙升
杭州瑞晶整形,http://y.soyoung.com/cp136735,1180,【伊婉玻尿酸1ml】爆款伊婉玻尿酸1180元，饱满的五官，让你更自信面对人生~
徐州王医生医疗美容诊所（泉山区王莹医疗美容诊所）,http://y.soyoung.com/cp137811,860,【伊婉玻尿酸1ml】打造立体饱满少女脸整体面部轮廓塑形
兰州圣莫丽斯医疗美容门诊部,http://y.soyoung.com/cp125003,2980,【伊婉玻尿酸1ml】韩国原装进口伊婉大分子玻尿酸1ml 轻松变女神
武汉蜜司医疗美容,http://y.soyoung.com/cp295787,366,【玻尿酸】舒颜 舒颜 1ml ，❤私信红包①玻尿酸打造少女脸②支持现场正品验证③润百颜/伊婉/瑞蓝/艾丽薇/舒颜
北京嘉韵医疗美容诊所,http://y.soyoung.com/cp157569,980,【伊婉玻尿酸1ml】伊婉C 重塑立体轮廓 逆转肌肤年龄 原装进口 支持现场验货 下单即送光子嫩肤
重庆徐铎丽格医疗美容,http://y.soyoung.com/cp34284,980,【伊婉玻尿酸1ml】伊婉正品玻尿酸 1ml 玻尿酸隆鼻填充重塑面部轮廓 @田云浩专家定制专属你的美
广州韩后医疗美容,http://y.soyoung.com/cp263239,2680,【玻尿酸】伊婉 伊婉V 1ml ，【六月童颜季】【伊婉1ml玻尿酸】 正品保证支持现场验真伪 限购1支
泽尔医疗美容诊所,http://y.soyoung.com/cp23017,680,【伊婉玻尿酸1ml】1ml/ 限时特惠 立体面孔一站打造  持久效果，效果自然，见效快
哈尔滨美联致美整形医院,http://y.soyoung.com/cp12734,999,【玻尿酸隆鼻】【伊婉C小分子】限时特惠，到6月15日，进口玻尿酸保证正品，支持验货
郑州爱美丽医疗美容门诊部,http://y.soyoung.com/cp201464,1680,【伊婉玻尿酸1ml】紧致塑形，高效除皱，补水保湿，保持年轻状态
哈尔滨臻美医疗美容,http://y.soyoung.com/cp78007,3280,【伊婉玻尿酸】正品进口大分子伊婉V玻尿酸 院长亲自注射 用于面部不同部位注射填充
长沙晶肤医疗美容,http://y.soyoung.com/cp138799,780,【玻尿酸隆鼻】【伊婉限时预售】除皱、填充、塑形，正品安全双保障。 预售时间为6月1日至6月21
北京彤美医美美容门诊部,http://y.soyoung.com/cp166516,599,【伊婉玻尿酸1ml】伊婉玻尿酸 玻尿酸注射 玻尿酸填充苹果肌/额头/太阳穴/法令纹/下巴/隆鼻/面颊
珠海韩妃医疗美容,http://y.soyoung.com/cp307889,398,【玻尿酸】海薇 海薇 0.5ml ，【玻尿酸特价抢购】海薇 伊婉 瑞蓝  塑美入门初体验 限购1支
温州艺星医学美容医院,http://y.soyoung.com/cp127642,1980,【伊婉玻尿酸1ml】【毕业季 正美丽】品牌授权/正规注射/安全/国际正规连锁18连锁整形
成都美极医疗美容,http://y.soyoung.com/cp1958,1980,【玻尿酸丰面颊】【伊婉V玻尿酸】低价不限购 下单享折 原装进口  支持验货 持久塑形   
北京美再生医疗美容诊所,http://y.soyoung.com/cp185748,1980,【伊婉玻尿酸1ml】韩国伊婉 V 玻尿酸1ml（限购一次）  正品注射 塑形更持久
四川华人医联整形美容医院,http://y.soyoung.com/cp108537,980,【伊婉玻尿酸1ml】无注射费点名费 安心变美 重塑立体轮廓 立体塑颜（每人限购一次）
潍坊华美医疗美容医院,http://y.soyoung.com/cp144412,1690,【伊婉玻尿酸1ml】 明星“驻颜魔法”原装正品，专家免费注射 
常熟时代医疗美容门诊部,http://y.soyoung.com/cp60196,1680,【伊婉玻尿酸1ml】【伊婉 1ml】让你拥有精致轮廓 光滑鲜嫩美肌~
云南华美美莱美容医院,http://y.soyoung.com/cp129147,2980,【伊婉玻尿酸1ml】【618年中促】【伊婉V玻尿酸】私信领618红包 立体五官 “填”生丽质 招募模
长春市盛羽国际医美,http://y.soyoung.com/cp242270,3500,【伊婉玻尿酸1ml】【伊婉C玻尿酸1ml】伊婉4支 高案例返现 面部填充 下单有礼 赠送水氧活肤
北京新美荟医疗美容诊所,http://y.soyoung.com/cp295294,1280,【玻尿酸】伊婉 伊婉V 1ml ，【下单到院就送小气泡】【伊婉V玻尿酸1280】可填充可塑性，轻松拥有元气少女脸
南京颜初医疗美容门诊部,http://y.soyoung.com/cp113267,820,【伊婉玻尿酸1ml】原装韩国进口玻尿酸，颠覆价820，超高性价比让你悄悄变美！
南昌莱美美容医院,http://y.soyoung.com/cp108850,749,"【玻尿酸丰唇】【私信领红包】伊婉C,含注射费，麻药费，正品足量名医注射。"
武汉市洪山伊莱美医疗美容门诊部,http://y.soyoung.com/cp41749,980,【伊婉玻尿酸1ml】韩国原装进口玻尿酸 院长注射 不限购 正品保证 假一罚十
南昌大学医疗美容,http://y.soyoung.com/cp170002,738,【伊婉玻尿酸1ml】 原装伊婉玻尿酸，面部填充，除皱塑性，下单送玻尿酸补水1次，香奈儿CoCo香水哦
郑州兰茜整形,http://y.soyoung.com/cp158246,5990,【伊婉玻尿酸2ml】+瘦脸针+下颌线提升=小V脸套餐 院长操刀 秒变女神
武汉市洪山伊莱美医疗美容门诊部,http://y.soyoung.com/cp178462,980,【伊婉玻尿酸1ml】韩国进口伊婉c型玻尿酸 正品保证 院长注射免注射费 假一罚十
长沙艾依美医疗美容,http://y.soyoung.com/cp19212,980,【伊婉玻尿酸1ml】原装进口伊婉C 伊碗V玻尿酸1ml 填充塑形 抗衰除皱私信立减30元
芜湖美人鱼医疗美容（陈伟中医疗美容）,http://y.soyoung.com/cp121718,1680,【伊婉玻尿酸1ml】韩国进口伊婉C玻尿酸1ml，立体塑型，更长效，立体五官“侧颜杀”
武汉恩吉娜医疗美容,http://y.soyoung.com/cp122345,799,【伊婉玻尿酸1ml】正品进口玻尿酸 给你饱满立体面容  限购2支
石家庄艾麦德医疗美容,http://y.soyoung.com/cp32556,1080,【玻尿酸隆鼻】【六六特惠】进口伊婉C小分子1ml♀原装正品 微微一调很倾城 理想容颜你也可以
北京常好丽格医疗美容门诊部,http://y.soyoung.com/cp43658,2980,【伊婉玻尿酸1ml】韩国进口伊婉长效玻尿酸 1ML
石家庄越然医疗美容,http://y.soyoung.com/cp253511,1080,"【伊婉玻尿酸1ml】【高端玻尿酸爆款】韩国原装正品伊婉C，微雕立体塑形,逆转肌肤年龄"
