hospital_name,link,price,title成都美极医疗美容,http://y.soyoung.com/cp280403,1980,【玻尿酸】伊婉 伊婉V 1ml ，【品牌厂商指定注射】招募模特5名！美得无痕迹。
台州维多利亚医疗美容,http://y.soyoung.com/cp290662,999,【伊婉玻尿酸1ml】伊婉 伊婉C 1ml ，台州维多利亚 伊婉玻尿酸1ml
米兰（武汉）医疗美容,http://y.soyoung.com/cp302086,3680,【玻尿酸】伊婉 伊婉C 1ml ，【玻尿酸丰苹果肌】下单来院即送万元大礼包 玲珑轮廓 限购2支 免注射费 告别松皱
武汉米兰医疗美容门诊部,http://y.soyoung.com/cp302226,3680,【玻尿酸】伊婉 伊婉C 1ml ，【玻尿酸垫下巴】立体轮廓塑形 塑造精致五官 正规品质，当场验货
武汉米兰医疗美容门诊部,http://y.soyoung.com/cp302329,3680,【玻尿酸】伊婉 伊婉C 1ml ，【米兰变美季】玻尿酸丰卧蚕 正品保证
武汉米兰医疗美容门诊部,http://y.soyoung.com/cp302517,3680,【玻尿酸】伊婉 伊婉C 1ml ，【玻尿酸】微整注射  原装 正品 质量保障，支持当场验货
淮北銘一医疗美容,http://y.soyoung.com/cp248229,1980,【伊婉玻尿酸1ml】【伊婉玻尿酸1ml】伊婉c玻尿酸太阳穴苹果肌下巴泪沟唇部面部细纹正品保证先验后打
长沙真爱医疗美容,http://y.soyoung.com/cp252973,1680,【伊婉玻尿酸1ml】【私信咨询更优惠】进口玻尿酸填充补水塑形 正品保障 支持当场验货 立竿见影
广西玉林现代医院（华美整形）,http://y.soyoung.com/cp253512,2980,【伊婉玻尿酸1ml】【私信领红包】玉林华美伊婉V大分子玻尿酸 名医注射 长效持久 写日记获20%返现
洛阳毛大夫医疗美容门诊部,http://y.soyoung.com/cp269336,1380,【玻尿酸】伊婉 伊婉C 1ml ，【伊婉玻尿酸】塑型填充，变美不等待
临沂东方美莱坞整形美容,http://y.soyoung.com/cp296294,1280,【玻尿酸】伊婉 伊婉C 1ml ，私信送脱毛 伊婉1ml微整人气爆款玻尿酸  隆鼻 隆下巴 保证正品 支持验货
重庆欣奕医疗美容诊所,http://y.soyoung.com/cp235289,3280,【伊婉玻尿酸1ml】【伊婉玻尿酸V型】打造黄金标准脸 你与网红只差一支玻尿酸
南通俪人连天美医疗美容医院,http://y.soyoung.com/cp239320,1380,【伊婉玻尿酸1ml】进口玻尿酸注射填充，水润塑形，补水保湿，塑造精致五官，当场拆验，高性价比
石家庄星源美天医疗美容医院,http://y.soyoung.com/cp218791,960,【伊婉玻尿酸1ml】2支起购！伊婉C玻尿酸  填充塑形 更适合亚洲人的玻尿酸
上海美立方医疗美容医院,http://y.soyoung.com/cp231747,2980,【伊婉玻尿酸1ml】【伊婉V玻尿酸】伊婉V大分子，立体五官即刻拥有，捏出小V脸！
成都晶都医疗美容医院,http://y.soyoung.com/cp302928,880,【玻尿酸】伊婉 伊婉C 1ml ，伊婉玻尿酸韩国进口玻尿酸伊碗C精塑五官塑形填充打造天然初恋脸
武汉米兰医疗美容门诊部,http://y.soyoung.com/cp303401,3680,【玻尿酸】伊婉 伊婉C 1ml ，【米兰变美季】【玻尿酸全身填充】变美就是如此简单
米兰（武汉）医疗美容,http://y.soyoung.com/cp305086,3680,【玻尿酸】伊婉 伊婉C 1ml ，【米兰变美季】【玻尿酸丰眉弓】
米兰（武汉）医疗美容,http://y.soyoung.com/cp305326,3680,【玻尿酸】伊婉 伊婉C 1ml ，【米兰变美季】【玻尿酸丰鼻基底】拯救你的小塌鼻
米兰（武汉）医疗美容,http://y.soyoung.com/cp305346,3680,【玻尿酸】伊婉 伊婉C 1ml ，【米兰变美季】【玻尿酸丰眼窝】萌妹无辜大眼
米兰（武汉）医疗美容,http://y.soyoung.com/cp305364,3680,【玻尿酸】伊婉 伊婉C 1ml ，【米兰变美季】【玻尿酸全脸填充】美丽一夏
揭阳华美医疗美容机构,http://y.soyoung.com/cp305419,1580,【玻尿酸】伊婉 伊婉C 1ml ，韩国原装进口，网红钟爱的美颜神器，质量效果双重保障
武汉亚韩整形外科医院,http://y.soyoung.com/cp305623,2680,【玻尿酸】伊婉 伊婉V 1ml ，【伊婉V型玻尿酸1ML】亚韩三级整形外科医院  原装进口 正品保证
武汉尊丽医疗美容门诊部,http://y.soyoung.com/cp305768,1280,【玻尿酸】伊婉 伊婉C 1ml ，伊婉玻尿酸1ML填泪沟 长效塑形 打造精致脸蛋 原装真品支持当场检验
济南吉芙医疗美容诊所,http://y.soyoung.com/cp308235,1980,【玻尿酸】瑞蓝 瑞蓝2号 1ml ，舒颜/瑞蓝/伊婉Plus/法思丽玻尿酸，丰太阳穴/丰额头/丰苹果肌/丰下巴/隆鼻
青岛韩松哲医疗美容诊所    ,http://y.soyoung.com/cp310382,780,【玻尿酸】伊婉 伊婉C 1ml ，【伊婉玻尿酸】伊婉C（私信有红包）特惠1ml韩国原装正品玻尿酸 
珠海新颜医疗美容,http://y.soyoung.com/cp311896,1980,【玻尿酸】伊婉 伊婉V Plus 1ml ，伊婉Vplus长效带麻玻尿酸，院长亲自注射
深圳博爱医院,http://y.soyoung.com/cp316543,980,【玻尿酸】伊婉 伊婉C 1ml ，伊婉C 1ML 青春减龄 明星力荐 正品保障 免费注射
天津中怡医学美容门诊部,http://y.soyoung.com/cp316744,979,【玻尿酸】伊婉 伊婉V Plus 1ml ，【伊婉玻尿酸1ml】【伊婉C】韩国进口玻尿酸 原装进口 正品保障 更适合亚洲人的
东莞美立方整形美容医院,http://y.soyoung.com/cp264273,3980,【玻尿酸】伊婉 伊婉V Plus 1ml ，【年中大促】1、下单送200无门槛券2、满额超值换购3、好评有礼
成都美芯东裕医疗美容,http://y.soyoung.com/cp152710,720,【伊婉玻尿酸1ml】伊婉进口玻尿酸C型 隆鼻 丰下巴  填充苹果肌  填充太阳穴 丰面颊
苏州紫馨医疗美容医院,http://y.soyoung.com/cp268676,3980,【玻尿酸】伊婉 伊婉V Plus 1ml ，台湾、香港医生注射  鸡尾酒疗法注射
颜如玉医疗美容,http://y.soyoung.com/cp316888,1280,【玻尿酸】伊婉 伊婉C 1ml ，【全脸注射】【征集10名案例免费注射】汪书平院长亲诊，塑形保湿，远离皱纹！
长沙梵童医疗美容,http://y.soyoung.com/cp296344,2180,【玻尿酸】伊婉 伊婉V 1ml ，【拒绝假案例/假材料】伊婉C/V玻尿酸·面部塑形
红颜拜博医疗美容,http://y.soyoung.com/cp307936,1980,【玻尿酸】伊婉 伊婉C Plus 1ml ，【伊婉玻尿酸】韩国原装进口 更适合亚洲人の玻尿酸 持久塑形 精准变美
贵阳华美医疗美容皮肤管理中心,http://y.soyoung.com/cp315779,3344,【玻尿酸】伊婉 伊婉C Plus 1ml ，名医注射 即做即走 无额外费用
石家庄欣奕医疗美容,http://y.soyoung.com/cp234596,1680,【伊婉玻尿酸1ml】【伊婉玻尿酸】打造黄金标准脸 你与网红只差一支玻尿酸
武汉米兰医疗美容,http://y.soyoung.com/cp318213,3680,【玻尿酸】伊婉 伊婉C 1ml ，【米兰变美季】玻尿酸丰太阳穴  自信开始的第一步
成都柏菲丝医学美容门诊部有限公司,http://y.soyoung.com/cp130936,1680,【伊婉玻尿酸1ml】【进口玻尿酸】【限量放送】伊婉玻尿酸 填充塑形＋立体轮廓＋美肤嫩肤＋女神必备
芜湖市第一人民医院,http://y.soyoung.com/cp28509,1980,【伊婉玻尿酸】【芜湖@白云亮】伊婉玻尿酸1ML 轻松微整形
荆门仁爱整形美容,http://y.soyoung.com/cp71748,1998,【伊婉玻尿酸】1ML伊婉玻尿酸 真品真量
昆明典雅阁医疗美容诊所,http://y.soyoung.com/cp108052,2400,【伊婉玻尿酸1ml】专家注射 原装正品 支持验真  （私信领红包 日记再返现）
上海伯思立医疗美容门诊部,http://y.soyoung.com/cp53768,2980,【玻尿酸垫下巴】伊婉V 玻尿酸 1ml  原装进口  大分子塑形  
澳门奥拉克皮肤医学美容诊所,http://y.soyoung.com/cp56922,775,【水光针】伊婉原装正品，普通级水光针
哈尔滨市道里区瑞格光谱医疗美容门诊,http://y.soyoung.com/cp91759,1000,【韩国伊婉玻尿酸1ml】【韩国伊婉玻尿酸1ml】塑造面部甜美盈润 颜值飙升更涨气质
哈尔滨市道里区瑞格光谱医疗美容门诊,http://y.soyoung.com/cp94325,1580,【韩国伊婉玻尿酸1ml】【韩国伊婉玻尿酸1ml
金华心艺整形美容,http://y.soyoung.com/cp103776,1680,【伊婉玻尿酸1ml】韩国原装进口正品1ml，限时限量抢购支持验证
脸秀医疗美容门诊部,http://y.soyoung.com/cp60482,6000,【伊婉玻尿酸】伊婉C1ml特惠 伊婉C5只6000
南宁韩星整形美容,http://y.soyoung.com/cp64086,2580,【伊婉玻尿酸1ml】韩国原装进口【伊婉玻尿酸】正品特价 玻尿酸隆鼻丰唇填充苹果肌太阳穴 填充面颊凹陷
北京杨仁宝医疗美容,http://y.soyoung.com/cp6416,1900,【伊婉玻尿酸】 1ML 北京杨仁宝院长亲自注射！
连云港华美整形医疗美容,http://y.soyoung.com/cp177490,1280,【伊婉玻尿酸1ml】【进口伊婉玻尿酸】原装正品  注射美颜  秒变女神
北京碧朗湾健康管理中心,http://y.soyoung.com/cp179434,699,【伊婉玻尿酸1ml】伊婉玻尿酸 新店开业 新年大促
大连维恩医疗美容,http://y.soyoung.com/cp180181,2980,【伊婉玻尿酸1ml】大分子玻尿酸 伊婉V 重塑脸部轮廓 韩国原装进口不限购 更适合亚洲人的玻尿酸 
北京悦丽汇财富中心诊所,http://y.soyoung.com/cp180596,1980,【伊婉玻尿酸1ml】伊婉v玻尿酸1ml，重塑精致立体容颜，首支体验价
上海东方丽人医疗美容门诊部,http://y.soyoung.com/cp253607,1380,【伊婉玻尿酸1ml】一针拥有高萌颜值，新客体验价1380元韩国原装进口伊婉玻尿酸，这个夏天让你美到底
长沙三和医疗美容,http://y.soyoung.com/cp256967,1080,【玻尿酸】伊婉 伊婉C 1ml ，【618电商节大放送】足量注射，保证正品，维持时间长 无隐性消费！私信有礼
长沙三和医疗美容,http://y.soyoung.com/cp257091,980,【玻尿酸】伊婉 伊婉C 1ml ，【玻尿酸去面部细纹】足量注射，保证正品，无隐性消费！私信有礼！
珠海方华整形美容门诊部 ,http://y.soyoung.com/cp258826,3980,【玻尿酸】法思丽 法思丽 1ml ，正品伊婉玻尿酸1ml，现场验证，塑型/除皱，愿时光不曾光顾你，私信有惊喜
天津和平高丽美迹皮肤诊所,http://y.soyoung.com/cp273340,1680,【玻尿酸】伊婉 伊婉V 1ml ，❤玻尿酸来袭❤ 瑞百颜/伊婉/艾丽薇  正品进口保证 无注射费/麻醉费 私信领
南通爱婍艺医疗整形· 中国区旗舰医院,http://y.soyoung.com/cp280651,2980,【玻尿酸】伊婉 伊婉V 1ml ，【明星产品】原装正品 免注射费 苹果肌/额头/太阳穴/卧蚕/嘟嘟唇/下巴/隆鼻
 深圳贝加美医疗美容门诊部,http://y.soyoung.com/cp281795,1080,【伊婉玻尿酸1ml】伊婉 伊婉C 1ml ，【全场八折】深圳贝加美伊婉玻尿酸，原装进口，长久保持。模特招募中，写日记高额返现
北京佳妍医疗美容诊所,http://y.soyoung.com/cp282018,699,【玻尿酸】伊婉 伊婉C 1ml ，私信发红包，填充面部/额头/苹果肌/隆鼻/下巴
福州格莱美美容医院,http://y.soyoung.com/cp282085,3200,【玻尿酸】伊婉 伊婉V Plus 1ml ，韩国进口 官方正品授权 名医专人专职注射
济南欣奕医疗美容诊所,http://y.soyoung.com/cp234809,1680,【伊婉玻尿酸1ml】【伊婉玻尿酸】打造黄金标准脸 你与网红只差一支玻尿酸
昆明欣奕医疗美容诊所,http://y.soyoung.com/cp235197,1680,【伊婉玻尿酸1ml】【伊婉玻尿酸】打造黄金标准脸 你与网红只差一支玻尿酸
重庆欣奕医疗美容诊所,http://y.soyoung.com/cp235299,1314,【伊婉玻尿酸1ml】【伊婉玻尿酸】打造黄金标准脸 你与网红只差一支玻尿酸
常德德美整形美容,http://y.soyoung.com/cp242531,680,【伊婉玻尿酸1ml】原装进口伊婉玻尿酸，品质保障
长沙希美医疗美容,http://y.soyoung.com/cp265793,1680,【玻尿酸】伊婉 伊婉C 1ml ，【玻尿酸丰眉弓】私信客服领红包 下单送美肤 主任注射免注射费
南充达芬奇医疗美容,http://y.soyoung.com/cp268765,1580,【玻尿酸】伊婉 伊婉C 1ml ，进口伊婉C玻尿酸小分子 正品保证 支持验货 专家注射 效果立显 重塑元气少女脸
武汉媄妲医疗美容（原武汉美天）,http://y.soyoung.com/cp268964,2980,【玻尿酸】伊婉 伊婉V 1ml ，媄妲暑期特惠 精致注射 抗衰除皱 院长亲诊 私信领1800 包机酒 安心变美
常州澳玛星光医疗美容门诊部,http://y.soyoung.com/cp269797,2280,【玻尿酸】伊婉 伊婉C 1ml ，原装进口正品玻尿酸 定制化注射打造自然立体轮廓
泉州西华医疗美容,http://y.soyoung.com/cp243170,1800,【伊婉玻尿酸1ml】主任亲诊，造面部年轻化 更饱满，下单有红包+送精美礼品
长沙健丽美臣铂宫医疗整形,http://y.soyoung.com/cp263829,1680,【玻尿酸】伊婉 伊婉C 1ml ，【玻尿酸丰眉弓】眉弓填充 支持验真 变美不留痕迹
天津维美医疗美容医院,http://y.soyoung.com/cp264000,999,【玻尿酸】伊婉 伊婉C 1ml ，进口名媛玻尿酸/缪斯女神俱乐部指定塑美医院
妙典医疗美容,http://y.soyoung.com/cp265760,8800,【玻尿酸】乔雅登 乔雅登极致 0.8ml ，玻尿酸隆鼻/丰唇/下巴填充/丰苹果肌，伊婉/艾莉薇/瑞蓝/乔雅登
郴州维纳斯整形美容医院,http://y.soyoung.com/cp201955,1800,【伊婉玻尿酸1ml】伊婉C型小分子玻尿酸，足量注射，全网特价，福利多多
嘉兴曙光整形,http://y.soyoung.com/cp152370,2000,【玻尿酸垫下巴】【伊婉classic玻尿酸1ml】
哈尔滨臻美医疗美容,http://y.soyoung.com/cp152823,3480,【伊婉玻尿酸1ml】韩国进口伊婉V-plus，18个月长效大分子，立体塑性，轻松美颜~
东阳丽莱医疗美容门诊部,http://y.soyoung.com/cp153465,980,【伊婉玻尿酸1ml】韩国伊婉C型玻尿酸1ML，让青春不再是奢侈品，变美不留痕迹
台州京蓉医疗美容门诊部,http://y.soyoung.com/cp153507,1880,【伊婉玻尿酸1ml】伊婉玻尿酸1ml支持单场验货
济南润境整形医院,http://y.soyoung.com/cp160294,3980,【伊婉玻尿酸1ml】小V脸套餐-提紧致提升+伊婉玻尿酸Volume-plus;1ml+瘦脸针100u
北京天使丽人医疗美容,http://y.soyoung.com/cp164395,2680,【伊婉玻尿酸1ml】进口伊婉v玻尿酸1ml 正品保证 逆龄填充 限时抢购
武汉康美莱医疗美容,http://y.soyoung.com/cp164981,1680,【伊婉玻尿酸1ml】【国外进口热销玻尿酸】100%正品 院长亲自注射  效果有保障
天津元和医院,http://y.soyoung.com/cp171052,4680,【肉毒素瘦脸】伊婉玻尿酸1ml+衡力肉毒100单位+小V线50根 打造网红小v脸必备（含局麻）
重庆潘多拉医疗美容,http://y.soyoung.com/cp173947,1800,【伊婉玻尿酸1ml】卖的不是产品 是【技术】效果满意高！
米兰（武汉）医疗美容,http://y.soyoung.com/cp302016,3680,【玻尿酸】伊婉 伊婉C 1ml ，【玻尿酸去法令纹】一针祛塑形 名医注射 即做即走 强效塑形 不影响工作 
武汉米兰医疗美容门诊部,http://y.soyoung.com/cp302475,3680,【玻尿酸】伊婉 伊婉C 1ml ，【玻尿酸】 原装正品1ML 支持当场验货，免注射费
武汉米兰医疗美容门诊部,http://y.soyoung.com/cp302530,3680,【玻尿酸】伊婉 伊婉C 1ml ，【玻尿酸】美颜神器 变美就是如此简单
济宁韩美医疗美容门诊,http://y.soyoung.com/cp302892,1980,【玻尿酸】伊婉 伊婉C 1ml ，【伊婉玻尿酸】专业医师正品注射 填充隆鼻/下巴/苹果肌/嘟嘟唇/法令纹
米兰（武汉）医疗美容,http://y.soyoung.com/cp305115,3680,【玻尿酸】伊婉 伊婉C 1ml ，【米兰变美季】【玻尿酸丰面颊】让你拥有饱满心形脸
南京和美医疗美容,http://y.soyoung.com/cp305156,780,【玻尿酸】伊婉 伊婉C 1ml ，【伊婉c玻尿酸】填充  塑形  除皱  限购一支
米兰（武汉）医疗美容,http://y.soyoung.com/cp305297,3680,【玻尿酸】伊婉 伊婉C 1ml ，【米兰变美季】【玻尿酸祛面部细纹】告别老态  年轻自然
西安逆时光医疗美容门诊部,http://y.soyoung.com/cp305341,980,【玻尿酸】伊婉 伊婉C 1ml ，【伊婉C玻尿酸1ml】打造上镜小V脸！五官轮廓立体塑形！
台州维多利亚医疗美容,http://y.soyoung.com/cp290664,2600,【伊婉玻尿酸1ml】伊婉 伊婉C Plus 1ml ，台州维多利亚 伊婉玻尿酸1ml
台州维多利亚医疗美容,http://y.soyoung.com/cp290665,3600,【伊婉玻尿酸1ml】伊婉 伊婉V Plus 1ml ，台州维多利亚 伊婉玻尿酸1ml
杭州颜术医疗美容连锁,http://y.soyoung.com/cp291311,4680,【玻尿酸】艾莉薇 艾莉薇 1ml ，【进口玻尿酸单支】艾莉薇、伊婉V-Plus、乔雅登ji致原装进口
杭州颜术医疗美容连锁,http://y.soyoung.com/cp291313,9800,【玻尿酸】乔雅登 乔雅登极致 0.8ml ，【进口玻尿酸单支】艾莉薇、伊婉V-Plus、乔雅登ji致原装进口
苏州美莱美容医院,http://y.soyoung.com/cp292662,1680,【玻尿酸】伊婉 伊婉C Plus 1ml ，【美莱618电商节】除皱补水 填充塑形 美莱专家注射 保证正品
紫藤花语医美连锁,http://y.soyoung.com/cp293171,1899,【伊婉玻尿酸】伊婉 伊婉V Plus 1ml ，特惠秒杀下单赠项目 正品长效 隆鼻/丰下巴/丰太阳穴/丰额头/丰苹果肌
广州美贝尔整形医院,http://y.soyoung.com/cp294930,980,【玻尿酸】伊婉 伊婉C 1ml ，【限时抢购】【韩国进口】3分钟塑性变美不留痕迹 韩国人气玻尿酸
武汉尊丽医疗美容门诊部,http://y.soyoung.com/cp305798,1280,【玻尿酸】伊婉 伊婉C 1ml ，伊婉玻尿酸 1ml玻尿酸填法令纹 还您年轻美丽
南京速丽医疗美容,http://y.soyoung.com/cp311990,880,【伊婉玻尿酸0.5ml】进口玻尿酸伊婉c 填充塑形 网红必备 
广州广美整形（旗舰店）,http://y.soyoung.com/cp312000,980,【玻尿酸】伊婉 伊婉C 1ml ，{年中感恩盛典大促}  私信送小气泡  伊婉进口玻尿酸  隆鼻塑形   
太原美诗沁医疗美容,http://y.soyoung.com/cp313567,1980,【玻尿酸】伊婉 伊婉C 1ml ，玻尿酸填充 大分子 小分子 隆鼻 下巴 太阳穴 面颊  卧蚕 泪沟 苹果肌
武汉洪山爱美汇整形美容,http://y.soyoung.com/cp314142,1999,【玻尿酸】伊婉 伊婉V 1ml ，V型大分子更持久➊院长注射➋送进口鼻假体➌送2888大礼包➍价格抄底现场验药
武汉洪山爱美汇整形美容,http://y.soyoung.com/cp314143,2199,【玻尿酸】伊婉 伊婉V Plus 1ml ，V型大分子更持久➊院长注射➋送进口鼻假体➌送2888大礼包➍价格抄底现场验药
 西安市新城区益民门诊部（整形美容科）,http://y.soyoung.com/cp314507,1680,【玻尿酸】伊婉 伊婉C 1ml ，【玻尿酸注射】『灵韵天鹅整形』①满减消费②到院有礼③模特返现
东莞百佳玛丽亚妇产医学美容 ,http://y.soyoung.com/cp315000,3680,【玻尿酸】伊婉 伊婉V 1ml ， 1ML原装进口 名医注射 打造饱满童颜！强力除皱补水！
武汉唯韩医疗美容医院,http://y.soyoung.com/cp299561,1980,【玻尿酸】伊婉 伊婉C 1ml ，假体隆鼻/注射隆鼻/硅胶隆鼻/膨体隆鼻/玻尿酸隆鼻/自体软骨垫鼻尖/韩国隆鼻
广州现代医学美容,http://y.soyoung.com/cp311199,980,【玻尿酸】伊婉 伊婉C 1ml ，【玻尿酸】伊婉 伊婉 1ml ，【玻尿酸】正品保障，有口皆碑，美丽无痕，无附加
曲靖华美美莱医疗美容门诊部,http://y.soyoung.com/cp311408,980,【玻尿酸】伊婉 伊婉C 1ml ，【伊婉玻尿酸1ml】①到院面诊可以领取鼻头小气泡1次②成交后免费水光针一次
长春珍妮医疗美容医院,http://y.soyoung.com/cp301276,1378,【玻尿酸】伊婉 伊婉V 1ml ， 韩国进口 伊婉玻尿酸 安全舒适 专业注射 精准变美 日记专享
颜如玉医疗美容,http://y.soyoung.com/cp300193,1280,【玻尿酸】伊婉 伊婉C 1ml ，【汪书平亲诊】两人同行立减300，韩国进口伊婉填充苹果肌/太阳穴/法令纹/丰唇等
西安逆时光医疗美容门诊部,http://y.soyoung.com/cp316672,980,【玻尿酸】伊婉 伊婉C 1ml ，【玻尿酸垫下巴】男神院长亲自注射 轻微改变 放肆绽放
重庆艺星医疗美容医院,http://y.soyoung.com/cp269025,2580,【玻尿酸】伊婉 伊婉V 1ml ，☆周年庆☆全场满二送一 正品品牌玻尿酸授权医师注射 18连城品质保障
重庆艺星医疗美容医院,http://y.soyoung.com/cp269026,1980,【玻尿酸】伊婉 伊婉C Plus 1ml ，☆周年庆☆全场满二送一 正品品牌玻尿酸授权医师注射 18连城品质保障
无锡坤如玛丽整形美容医院,http://y.soyoung.com/cp314549,1280,【玻尿酸】伊婉 伊婉C Plus 1ml ，热销进口玻尿酸，填充苹果肌/额头/鼻子/下巴/太阳穴等，正品保证
武汉蜜司医疗美容,http://y.soyoung.com/cp266399,980,【玻尿酸】伊婉 伊婉C 1ml ，❤私信红包①玻尿酸打造少女脸②支持现场正品验证③润百颜/伊婉/瑞蓝/艾丽薇/舒颜
贵阳华美医疗美容皮肤管理中心,http://y.soyoung.com/cp315777,980,【玻尿酸】伊婉 伊婉C 1ml ，名医注射 即做即走 无额外费用
美丝医疗美容门诊,http://y.soyoung.com/cp151325,1288,【伊婉玻尿酸1ml】【伊婉玻尿酸1ml】韩国原装进口 支持当场检验 轻松塑造女神脸 高鼻梁翘下巴
成都中科美美医疗美容,http://y.soyoung.com/cp152607,1314,【伊婉玻尿酸1ml】【女神V脸套餐】水光针+瘦脸针+玻尿酸，女人三件宝 填充瘦脸补水好
东阳丽莱医疗美容门诊部,http://y.soyoung.com/cp153462,5800,【伊婉玻尿酸1ml】伊婉V型1ML长效玻尿酸 精塑五官/俊俏美鼻/乖巧下巴/怎么迷人怎么来
武汉天申医疗美容门诊部,http://y.soyoung.com/cp160851,1800,【伊婉玻尿酸1ml】【伊婉玻尿酸1ml】微整形 塑形 除皱 院长亲自注射 立体五官
永州新唯美整形美容医院,http://y.soyoung.com/cp161805,899,【玻尿酸全脸填充】【新唯美新年焕新】全场特价啦！伊婉C型玻尿酸1ml 限购2支 正品保障 塑造美颜
台州百佳东方妇产医院,http://y.soyoung.com/cp228653,1280,【玻尿酸全脸填充】【伊婉玻尿酸 】伊婉玻尿酸C型【咨询即送补水一次】
长沙三和医疗美容,http://y.soyoung.com/cp256971,1080,【玻尿酸】伊婉 伊婉C 1ml ，【618电商节大放送】足量注射，保证正品，维持时间长 无隐性消费！私信有礼！
长沙三和医疗美容,http://y.soyoung.com/cp257081,980,【玻尿酸】伊婉 伊婉C 1ml ，【618电商节大放送】足量注射，保证正品，无隐性消费！私信有礼！
金丁儿医疗美容诊所,http://y.soyoung.com/cp258160,1380,【玻尿酸】伊婉 伊婉C 1ml ，伊婉玻尿酸丰下巴    饱满自然尖挺翘
洛阳爱尚医疗美容门诊部,http://y.soyoung.com/cp260369,1500,【玻尿酸】伊婉 伊婉C 1ml ，【伊婉c 1ml】进口人气玻尿酸 塑脸神器 告别面部凹陷
上海哲天医疗美容门诊部,http://y.soyoung.com/cp261941,466,【玻尿酸】润百颜 润百颜白紫 1ml ，【你写日记我返现】润百颜 伊婉 爱芙莱1ML 填充 去皱纹
厦门思明云艺美整形外科门诊部,http://y.soyoung.com/cp263640,980,【伊婉玻尿酸1ml】伊婉 伊婉C 1ml ，伊婉C玻尿酸 填充凹陷 美塑五官 立体轮廓 专家注射！可支持验货！
妙典医疗美容,http://y.soyoung.com/cp265761,2800,【玻尿酸】瑞蓝 瑞蓝2号 1ml ，玻尿酸隆鼻/丰唇/下巴填充/丰苹果肌，伊婉/艾莉薇/瑞蓝/乔雅登
重庆奥丽整形美容医院,http://y.soyoung.com/cp236058,999,【衡力肉毒素50单位】V脸套餐：衡力瘦脸针+伊婉C 打造精致女神脸
温州艺星医学美容医院,http://y.soyoung.com/cp269732,7800,【玻尿酸】伊婉 伊婉V 1ml ，【毕业季 正美丽】进口伊婉V 塑形效果更佳/保持时间更久
北京美颐天医疗美容门诊部,http://y.soyoung.com/cp290512,1980,【玻尿酸】伊婉 伊婉V 1ml ，【私信送脱毛+红包】韩国伊婉玻尿酸  重塑面部轮廓
成都美丽部落医疗美容 ,http://y.soyoung.com/cp290533,680,【玻尿酸全脸填充】伊婉 伊婉C 1ml ，【任选1ML玻尿酸】荟美正品  全面打造初恋脸
深圳爱彼彼尔医疗美容门诊部,http://y.soyoung.com/cp291044,980,【玻尿酸】伊婉 伊婉C 1ml ，丰面颊/注射隆鼻/填充苹果肌 告别面部凹陷，打造小V脸
北京伊莎雅轩医疗美容医院 ,http://y.soyoung.com/cp244622,2980,【伊婉玻尿酸1ml】韩国原装进口 伊婉v大分子玻尿酸 让你有型可颜 
东莞美立方整形美容医院,http://y.soyoung.com/cp245886,4980,【伊婉玻尿酸1ml】伊婉Cplus + 伊婉V plus 原装正品支持当场检验
武汉克拉皇后医疗美容门诊部,http://y.soyoung.com/cp127887,799,【伊婉玻尿酸1ml】韩国伊婉玻尿酸1ml 原装正品 支持验货 限时特惠
杭州古浚整形美容,http://y.soyoung.com/cp42111,1880,【伊婉玻尿酸】C型1ml
伊莎贝尔医疗美容门诊部,http://y.soyoung.com/cp50045,1080,【伊婉玻尿酸】院庆大回馈伊婉玻尿酸1080（1毫升）
株洲市中心医院,http://y.soyoung.com/cp53649,2280,【伊婉玻尿酸】【株洲市中心医院@黄挺】韩国伊婉玻尿酸限购一次单次体验
唯美醫美診所,http://y.soyoung.com/cp56445,1388,【水光针】韩国特级水光针! +伊婉玻尿酸1ml+保妥适肉毒素20单位
东莞市东城非凡美容医院,http://y.soyoung.com/cp89439,1980,【玻尿酸隆鼻】进口伊婉玻尿酸C1ml 打造自然女神 悄悄变美五官立体不夸张
